frequency	28019	The doctor visits her every other day.	医者は１日おきに彼女をみにくる。
frequency	28251	The committee meets twice a month.	委員会は月に２回開かれる。
frequency	28899	We cannot know too much about the language we speak every day of our lives.	われわれが毎日の生活で話している言葉についてはどんなに多く知っても知りすぎるということはない。
frequency	28929	I study about two hours every day.	私は毎日およそ二時間勉強する。
frequency	29032	I always walk to school.	私はいつも歩いて学校に行く。
frequency	29310	I used to go to plays at least once a week in London.	ロンドンでは少なくとも週に１度は芝居を見に行ったものです。
frequency	29328	We have lobsters only on special occasions.	ロブスターは特別な場合にしか食べない。
frequency	29338	Robert comes to visit me every now and then.	ロバートは時々私を訪ねて来る。
frequency	29506	I remember singing scales every day during music lessons.	レッスンの時は毎日音階を歌っていたのを覚えています。
frequency	29673	She lives near the edge of Wripple, so she drives in every day.	リプルのはずれ近くに住んで、毎日車を運転して来ます。
frequency	29958	I often go to the movies.	よく映画を見に行きます。
frequency	31794	I seldom go to a library.	私はめったに図書館に行かない。
frequency	32930	Mike eats out almost every night.	マイクはほとんど毎晩外食だ。
frequency	33193	Bob writes to me once a month.	ボブは月に一度私に手紙を書く。
frequency	33307	Most Japanese take a bath every day.	ほとんどの日本人が毎日、風呂に入ります。
frequency	33308	Most Japanese eat rice at least once a day.	ほとんどの日本人が少なくとも１日に１度は米を食べる。
frequency	33835	Helen visits her uncle every Sunday.	ヘレンは日曜日ごとに叔父さんを訪問する。
frequency	34530	Bill often goes to the park.	ビルはよくその公園へ行く。
frequency	34576	Bill and John like to get together once a month to shoot the breeze.	ビルとジョンはおしゃべりするために月に１回会うのが好きだ。
frequency	35307	How often do the buses run?	バスはどれくらいの間隔で走っていますか。
frequency	35327	Buses are running at 20 minute intervals.	バスは２０分間隔で運行されている。
frequency	35328	There is a bus every fifteen minutes.	バスは１５分間隔で運転されている。
frequency	35329	The bus leaves every fifteen minutes.	バスは１５分ごとにでます。
frequency	35331	The buses run every ten minutes.	バスは１０分ごとに通っている。
frequency	35332	The bus leaves every ten minutes.	バスは１０分おきにきます。
frequency	36179	Nancy never fails to write to me once a month.	ナンシーは月に一度必ず私に便りをくれる。
frequency	36473	Why do you study every day?	なぜあなたは毎日勉強するのですか。
frequency	36745	However cold it may be, he still jogs 20 kilometers every day.	どんなに寒くても、彼は毎日２０キロジョギングをする。
frequency	37105	Tom sometimes rips off his customers.	トムは時々、彼のお客をだましてお金をまきあげる。
frequency	37685	Does Tony run every day?	トニー君は毎日走りますか。
frequency	37686	Tony runs every day.	トニー君は毎日走ります。
frequency	37687	How long does Tony run every day?	トニー君は毎日どれぐらい走りますか。
frequency	38035	No matter where you may travel, be sure to phone me once a week.	どこを旅行していようとも、週に１度は必ず電話をください。
frequency	38265	Every now and then I like to have hot and spicy food.	ときどき私は辛くてスパイスのきいたものを食べたくなる。
frequency	38268	Please write to me from time to time.	たまには手紙を書いてください。
frequency	38273	Now and then, we go to London on business.	ときどき、私たちは商用でロンドンへ行く。
frequency	38277	I hear from him once in a while.	ときたま彼から便りがあります。
frequency	39041	The door is opened every morning.	ドアは毎朝開けられます。
frequency	40780	She paints every day no matter how busy she is.	たとえどんなに忙しくても、彼女は毎日絵を描いている。
frequency	43366	The old man sometimes talks to himself.	その老人は時々独り言を言う。
frequency	44401	That program is broadcast every other week.	その番組は１週間おきに放送される。
frequency	44832	Those trains run every three minutes.	その電車は３分おきにでています。
frequency	46724	The class meets once a week.	その授業は週一回あります。
frequency	47741	The magazine comes out every week.	その雑誌は毎週出る。
frequency	47745	The magazine comes out once a week.	その雑誌は週に一回発行される。
frequency	47749	The magazine is issued twice a month.	その雑誌は月に二度発行されている。
frequency	48216	The dog eats a lot of meat every day.	その犬は毎日たくさん肉を食べる。
frequency	48285	Please feed the dog every day.	その犬に毎日食べ物をやって下さい。
frequency	49389	The house gets painted every five years.	その家は５年ごとに塗り替えられる。
frequency	49569	Their influence becomes greater every day, but they are uncreative and can't make value judgements.	その影響力は日毎にますます大きくなっているが、しかし創造性があるわけではなく、また、価値の判断もできない。
frequency	50884	How often have you been there?	これまでに何回そこへ行きましたか。
frequency	51474	Excuse me. How often do shuttle buses run to downtown New York?	すみません。ニューヨーク市外にいくシャトルバスはどのくらいの間隔で走っていますか。
frequency	52620	John writes a letter to his parents once a month.	ジョンは月に一度両親に手紙を書く。
frequency	55343	How often have you been here?	これまで何回行きましたか。
frequency	55607	This is one of the jobs I have to do every day.	これは私の毎日の決まった仕事の一つだ。
frequency	55644	This is the dictionary I use every day.	これは私が毎日使っている辞書です。
frequency	56405	The garbage collector comes three times a week.	ごみは週３で集めに来る。
frequency	56588	Take this medicine twice a day.	この薬を１日２回飲みなさい。
frequency	57894	This local newspaper is published once a week.	この地方新聞は週に１回発行される。
frequency	59196	This magazine is issued every month.	この雑誌は毎月出る。
frequency	62434	Ken calls me every day.	ケンは毎日私に電話をかけてくる。
frequency	62436	Ken makes his own bed every morning.	ケンは毎朝自分でベッドを整えます。
frequency	62674	Kate drinks a lot of milk every day.	ケイトは毎日牛乳をたくさん飲みます。
frequency	62876	Is there practice every day?	クラブ活動は毎日ありますか。
frequency	63734	Take this medicine for your cold three times a day.	かぜにはこの薬を一日三回飲みなさい。
frequency	64806	The Olympic Games are held every four years.	オリンピックは4年に1度開催される。
frequency	65377	Amy walks to the station every morning.	エイミーは毎朝駅まで歩いていく。
frequency	68439	That theater has a foreign film festival every other month.	あの劇場では外国映画祭を１ヶ月おきに実地している。
frequency	68589	That restaurant prepares two thousand meals every day.	あのレストランは毎日二千食準備している。
frequency	68719	That couple gets soused nearly every night.	あのカップルはほとんど毎日酔っ払っている。
frequency	68917	Do you go to school on foot every day?	あなたは毎日歩いて学校へ行きますか。
frequency	68918	Do you run every day?	毎日走っているのですか？
frequency	68919	Do you go shopping every day?	あなたは毎日買い物に行きますか。
frequency	68920	Do you listen to the radio at home every day?	あなたは毎日家でラジオを聞いているのですか。
frequency	68922	What time do you get up every day?	あなたは毎日何時に起きますか。
frequency	68923	How long do you play tennis every day?	あなたは毎日どれぐらいテニスをしますか。
frequency	68924	How long do you study English every day?	あなたは毎日どのくらい英語を勉強しますか。
frequency	69586	How often did you visit Kyoto?	あなたは何回京都を訪れましたか。
frequency	69688	How many times a week do you go shopping at a supermarket?	あなたは一週間に何回ぐらいスーパーへ買い物に行きますか。
frequency	69837	How often do you see Tanaka?	あなたはどのくらい田中さんと会っているの。
frequency	72414	Take this medicine every six hours.	６時間ごとにこの薬を飲みなさい。
frequency	72578	Take this medicine every four hours.	４時間おきにこの薬をのみなさい。
frequency	72752	I run to the toilet every thirty minutes.	３０分おきにトイレに行きます。
frequency	72934	We read the meter once every two months.	２ヶ月に１度メーターを検査します。
frequency	73078	Please be sure to take one dose three times a day.	１日に３度１錠ずつ服用してください。
frequency	73079	Take the medicine three times a day.	１日に３回、この薬を服用しなさい。
frequency	73084	At the end of every day, his back was tired and his legs hurt.	１日が終わると背中が疲れ、足が痛みました。
frequency	73085	I go shopping every other day.	１日おきに買い物に行く。
frequency	73139	Let's get together here once a week.	週に一度ここに集まりましょう。
frequency	237090	I swim in the sea every day.	毎日海で泳ぎます。
frequency	237597	Do you have to go there every day?	君は毎日そこへいかなくてはならないのですか。
frequency	237848	My brother goes fishing every weekend.	兄はいつも週末に釣りに行きます。
frequency	238799	You should write home once a month.	月に１度は家に手紙を書くべきだ。
frequency	238800	I put ten thousand yen into the bank every month.	私は毎月銀行に一万円貯金している。
frequency	238807	I go to the movies three or four times a month.	月に３、４回映画を見に行く。
frequency	238824	The moon goes round the earth once a month.	月は月に１回地球の周りを回る。
frequency	238914	Ken plays soccer every day.	健は毎日サッカーをする。
frequency	241163	The speaker referred to his notes every few minutes.	講演者は数分ごとにメモを参照した。
frequency	241412	One must practice every day in order to become a world-class athlete.	国際レベルの運動選手になるためには、毎日練習しなければならない。
frequency	242682	The whole class is present once a week.	クラスの全員が週に一回出席します。
frequency	244115	My wife and I like to go out for Chinese food once in a while.	妻と私はときどき好んで中華料理を食べに行く。
frequency	244146	My wife goes to the village market to buy foods every day.	妻は食品を買いに毎日村のマーケットに出かける。
frequency	244690	How often did you go swimming last summer?	昨年の夏は何回泳ぎにいきましたか。
frequency	244721	Last year, my brother was late for school every day.	昨年私の兄は毎日学校に遅刻していました。
frequency	245555	My sister sometimes makes our dinner.	姉が時々夕食を作る。
frequency	245781	Children play in this park every day.	子供たちは毎日この公園で遊びます。
frequency	245841	When I was a child, my mother made me eat green vegetables every day.	子供のころ、母は毎日私に野菜を食べさせました。
frequency	245846	When I was a child, I used to go to the seashore every summer.	子供のころは、毎年夏には海岸へ行ったものだ。
frequency	245992	Children should drink milk every day.	子供は毎日牛乳を飲むべきだ。
frequency	246095	The puppy grew larger and larger every day.	子犬は日に日に大きくなった。
frequency	246792	We used to swim every day when we were children.	私が子供の頃、毎日泳ぐのが常でした。
frequency	247304	It's good for us to eat vegetables every day.	私たちが毎日野菜を食べるのはよいことだ。
frequency	247389	Our garbage is collected three times a week.	私たちのゴミは週３回収集されます。
frequency	247806	We feed our dog three times a day.	私たちは一日に三回、犬に餌を与えている。
frequency	247875	We went to church every Sunday when we were in America.	私たちはアメリカにいたころ日曜日ごとに教会へ行った。
frequency	247892	We always spend our vacation by the sea.	私たちはいつも海のそばで休暇を過ごします。
frequency	248002	We often talked about Japanese politics.	私たちはしばしば日本の政治について話し合った。
frequency	248223	We go to the movies together once in a while.	私たちはときどきいっしょに映画を見に行く。
frequency	248224	We sometimes swim in the lake.	私たちはときどきその湖で泳ぎます。
frequency	248800	We go fishing once in a while.	私たちは時々魚釣りに行く。
frequency	248809	We go fishing together once in a while.	私たちは時折一緒に釣りに行きます。
frequency	248851	We gather here once a week.	私たちは週に１回ここに集まる。
frequency	248852	We dine out once a week.	私たちは週に一度外食する。
frequency	248888	We should read one book a month at least.	私たちは少なくとも月に一冊本を読むべきだ。
frequency	249025	We use a lot of water every day.	私たちは毎日たくさん水を使います。
frequency	249104	We always play tennis on Saturday morning.	私たちは土曜日の朝はいつもテニスをする。
frequency	249145	We often play cards on Sunday.	私たちは日曜日によくトランプをする。
frequency	249149	We get together once a year.	私たちは年に一度集まります。
frequency	249379	We play football every Saturday.	私たちは毎週土曜日にフットボールをする。
frequency	249380	We used to go skating every weekend.	私たちは毎週末になるとよくスケートに行っていました。
frequency	249382	We jog before breakfast every morning.	私たちは毎朝食前にジョギングをする。
frequency	249383	I play soccer every day.	私たちは毎日サッカーをします。
frequency	249385	We play tennis every day.	私たちは毎日テニスをします。
frequency	249386	We watch TV every day.	私たちは毎日テレビを見ます。
frequency	249388	We study English every day.	私たちは毎日英語を学ぶ。
frequency	249389	We study English at school every day.	私たちは毎日学校で英語を勉強する。
frequency	249392	We communicate with each other by telephone every day.	私たちは毎日電話で連絡を取り合っている。
frequency	249396	We hold an exhibition every year.	私たちは毎年展覧会を開く。
frequency	249539	We see each other at the supermarket now and then.	私たち二人は、時々スーパーマーケットで会う。
frequency	249912	I hear from him every now and then.	私には時々彼からの便りがある。
frequency	250245	My uncle calls on me every three days.	私のおじは３日ごとに私を訪ねてくる。
frequency	250249	My uncle comes to see me from time to time.	私のおじはときどき私を訪ねて来る。
frequency	250587	My family goes to Italy every year.	私の家族は毎年イタリアに行きます。
frequency	250768	My dog often lies on the grass.	私の犬はよく芝生の上に寝そべっている。
frequency	250769	My dog often pretends to be asleep.	私の犬はよく寝た振りをする。
frequency	250957	My sister often looks after the baby.	私の姉はよくその赤ん坊の世話をします。
frequency	250975	My sister usually walks to school.	私の姉は普通歩いて学校に行きます。
frequency	250977	My sister takes a shower every morning.	私の姉は毎朝シャワーを浴びます。
frequency	251355	My grandfather takes a walk every morning.	私の祖父は毎朝散歩します。
frequency	251734	My father reads the newspaper every morning.	私の父は毎朝新聞を読みます。
frequency	251736	My father is busy as a bee every day.	私の父は毎日とても忙しい。
frequency	251737	My father takes a walk every day.	私の父は毎日散歩します。
frequency	251813	My mother takes a nap every afternoon.	私の母は、毎日午後昼寝をします。
frequency	251833	My mother often suffers from headaches.	私の母はよく頭痛に悩まされる。
frequency	251857	My mother bakes bread every morning.	私の母は毎朝パンを焼く。
frequency	251858	My mother is busy as a bee every day.	私の母は毎日とても忙しい。
frequency	251862	My mother seldom watches TV at night.	私の母は夜めったにテレビを見ない。
frequency	251920	My sister washes her hair every morning.	私の妹は毎朝髪を洗う。
frequency	251963	My daughter never fails to write to me at least once a week.	私の娘は少なくとも週に一度は必ず手紙をくれます。
frequency	252372	I make it a rule to take a walk every morning.	私は、毎週散歩する事にしている。
frequency	252445	I usually go to the barber once a month.	私は１ヶ月に１回床屋に行く。
frequency	252481	I feed my dog twice a day.	私は１日２回犬にえさをやる。
frequency	252482	I go for a walk every other day.	私は１日おきに散歩に出かける。
frequency	252483	I go to the dentist every second day.	私は１日おきに歯医者に通っています。
frequency	252484	I go to the dentist's every other day.	私は１日おきに歯医者へ行く。
frequency	252485	I take a bath every other day.	私は１日おきに入浴する。
frequency	252708	I don't like your coming late every day.	私はあなたが毎日遅れてくるのが気に入らない。
frequency	253129	I go to the country every summer.	私はいつも夏はいなかへ行きます。
frequency	253461	I used to swim here every day.	私はここで毎日泳いだものだ。
frequency	254006	I like steak better than anything else, and eat it every other day.	私はステーキが何よりも好きで、一日おきに食べている。
frequency	254730	I saw the old man two or three times a week.	私はその老人を、週に２．３回見かけた。
frequency	255061	I'll come as often as possible.	私はできるだけしばしばまいります。
frequency	255064	I will write letters to you as often as I can.	出来るだけ手紙書くようにするよ。
frequency	255132	I watch television twice a week.	私はテレビを週に二回見ます。
frequency	255134	I watch television every day.	私はテレビを毎日見ます。
frequency	255195	I am absent from school on occasion.	私はときどき学校を休む。
frequency	255198	I sometimes look back on my childhood.	私はときどき子供のころを振り返る。
frequency	255199	I see him in the library now and then.	私はときどき図書館で彼に会う。
frequency	255201	I visited him once in a while.	私はときどき彼を訪ねた。
desire	1622	What do you want?	何が欲しいの？
desire	1891	She doesn't want to talk about it.	彼女はそのことについて話したくないんだよ。
desire	2067	I want a piece of candy.	飴がほしい。
desire	2161	I want an MP3 player!	ＭＰ３プレーヤーがほしい！
desire	2389	I don't want it anymore.	もうそれはいらない。
desire	2429	I want you to tell me the truth.	私には本当のことを話してもらいたい。
desire	16238	Would you like to go abroad?	君は外国へ行きたいですか。
desire	17089	I would like your picture.	君の写真が欲しいのですが。
desire	17291	I wish I could live near your house.	君の家の近くに住めたらいいのに。
desire	17434	I want you to go to the post office.	君に郵便局へ行ってもらいたい。
desire	17440	I want you to read this book.	君にこの本を読んで欲しいんだ。
desire	17469	I would like you to go instead of me.	君に私の代わりに行ってもらいたいのですが。
desire	17475	I wanted to show it to you.	君に見せてあげたかったよ。
desire	17488	I would like you to come with me.	君に一緒に来て欲しいのですが。
desire	17493	I want you to work harder.	君にもっとしっかり仕事をしてもらいたい。
desire	17494	I want to see you again.	あなたにもう一度会いたいな。
desire	17514	I expect you to be punctual.	君には時間を守ってもらいたい。
desire	17546	I'd like to talk with you in private.	君にちょっと話がある。
desire	17611	I'd like to go to the seaside with you.	君と一緒に海に行きたいのですが。
desire	17612	I wish I could go to the party with you.	君と一緒にパーティーに行ければいいのに。
desire	17620	I would like to go to the concert with you.	僕と一緒にコンサートに行って欲しいんだけど。
desire	17715	I want to know if you'll be free tomorrow.	君が明日暇かどうか知りたい。
desire	17787	I hope that you will get well soon.	どうかお大事になさってください。
desire	17838	I wish you could come with us.	君が一緒に来ることができたらいいのに。
desire	18302	I want a few empty glasses.	空のグラスがいくつか欲しい。
desire	18531	I wish I were rich.	お金持ちだったらなあ。
desire	18764	I hope it won't be long before I hear from her.	近いうちに彼女から便りがあることを願っている。
desire	18812	I would like to sit in the non-smoking section.	禁煙席をお願いします。
desire	19459	I want a quart of milk.	牛乳を１クオート下さい。
desire	19955	I wish I could break the habit of smoking.	喫煙の習慣をやめることができたらなあ。
desire	20278	I wish you would take me to a restaurant for a change.	たまには私をレストランに連れて行ってくれるといいのだが。
desire	20380	I wish I could think of something to say.	気の利いたことが言いたいけれどいえないなあ。
desire	20927	I want to get a sightseeing visa.	観光ピザを取りたいのですが。
desire	21335	I don't think any more students want to come.	来たいと思う生徒はもうこれ以上いないと思う。
desire	21430	The students wanted us to help push the car.	学生たちは私たちが車を押すのを手伝ってくれた。
desire	21442	The students were all looking forward to the summer vacation.	学生たちはみんな夏休みを楽しみに待っていた。
desire	21938	I want to go abroad.	海外に行きたい。
desire	22362	I hope I can hold on to my job.	会社をクビにならなきゃいいけどね。
desire	22540	I'd like to discuss the following at the meeting.	会議では下記を話し合うつもりです。
desire	23507	I hope the weather clears up before we have to leave.	我々が出発しなければならぬときの前に晴れてくれることを願う。
desire	24814	Above all, I want to be healthy.	何ものにもまして私は健康になりたい。
desire	24919	I hope I can manage to make both ends meet.	何とか収支が合えばいいんだが。
desire	25013	I want something cold to drink.	何か冷たいもの飲みたい。
desire	25020	Tell me what you want.	何が欲しいか言ってごらん。
desire	25049	I want something to read.	何か読むものが欲しい。
desire	25060	I want something hot to drink.	何か温かい飲み物がほしい。
desire	25072	I want something to eat.	何か食べたい。
desire	25078	I'd like something to eat.	何か食べるものが欲しいのですが。
desire	25088	I want something to write on.	何か書きつけるものが欲しい。
desire	25106	What do you want me to do?	いったい私にどうしろと？
desire	25179	I want something sweet to eat.	甘いものが食べたい。
desire	25192	I want something to drink.	何か飲み物が欲しい。
desire	25194	I'd like something to drink.	何か飲み物がほしいのですが。
desire	25298	I wish that I could give you something.	あなたに何かあげられたらなぁ・・・。
desire	25681	I want to go and cheer.	応援に行きたいわ。
desire	25694	I'd like to speak to the lady of the household.	奥様とお話ししたいのですが。
desire	26327	We wish we didn't have to take a test in English.	英語の試験を受けなくてもよければなあ。
desire	26333	I would like to be an English teacher.	英語の教師になりたいのです。
desire	26382	I wish I could speak English.	英語が話せたらいいのだが。
desire	26394	I'd like to master English.	英語がうまくなりたい。
desire	26397	I wish I could swim.	泳げたらいいのになあ。
desire	26412	Do you feel like going swimming?	泳ぎに行きたくないですか。
desire	26447	I'd like to go to the movies.	映画を見に行きたいな。
desire	26484	I don't feel like going to the movies. Let's take a walk instead.	映画に行きたいような気がしない。その代わり散歩をしよう。
