courtroom	2009	The murderer was convicted and sentenced to life in prison.	殺人犯は有罪判決を受けて終身刑に処せられた。
courtroom	16568	You have to judge the case without bias.	君はその問題を公正に判断しなければならない。
courtroom	17671	You've got no alibi for the day of the murder.	君たちにはその殺人事件の日のアリバイがない。
courtroom	30453	A more experienced lawyer would have dealt with the case in a different way.	もっと経験のある弁護士なら、その件は違ったやり方で処理しただろう。
courtroom	45263	That man is on trial for the murder of a little girl.	その男は幼い少女を殺したかどで裁判にかけられている。
courtroom	45377	The man went to pieces when the judge said he would have to go to prison for life.	その男は、終身刑であると裁判官が判決を下した時、取り乱した。
courtroom	45635	The judge in the case was not fair.	その訴訟の判事は公平ではなかった。
courtroom	47221	That matter was decided by the Supreme Court.	その事件は最高裁判所で解決された。
courtroom	47806	The judge reversed the final decision.	その裁判官は、最終判決をひるがえした。
courtroom	49645	The will was declared void by the court.	その遺言は法廷で無効と宣告された。
courtroom	243948	The Supreme Court overturned a previous decision.	最高裁は前回の判決を覆した。
courtroom	244211	Let's take it to court.	裁判で決着をつけましょう。
courtroom	244220	The judge concluded that the prisoner was innocent.	裁判官は、その囚人が無罪だと結論をくだした。
courtroom	244226	The judge decided against the plaintiff.	裁判官は原告に不利な判決を下した。
courtroom	244228	The judge sentenced him to a jail term of five years.	裁判官は彼に五年の懲役刑を宣告した。
courtroom	244229	The judge condemned him to death.	裁判官は彼に死刑を宣告した。
courtroom	244235	The attitude of the court toward young criminals is different from its attitude toward adult criminals.	裁判所が未成年の犯罪者に対してとる姿勢は成人の犯罪者に対する姿勢とは異なる。
courtroom	244240	The judge called for a recess of two hours.	裁判長は、２時間の休憩を告げた。
courtroom	244241	The presiding judge sentenced the defendant to death.	裁判長は被告に死刑の判決を言い渡した。
courtroom	263664	Which judge heard the case?	事件を審議したのはどの裁判官ですか。
courtroom	282740	The judge sentenced him to one year's imprisonment.	判事は彼に禁固１年を宣告した。
courtroom	282801	The criminal begged the judge for mercy.	犯人は裁判官に慈悲を請うた。
courtroom	282967	The court found him guilty of stealing money.	彼がお金を盗む罪を犯したことが法廷で明らかになった。
courtroom	287668	His life hangs on the judge's decision.	彼の命は判決いかんにかかっている。
courtroom	296825	He pleaded with the judge for mercy.	彼は裁判官に寛大な処置を願った。
courtroom	296826	He appealed to the judge for mercy.	彼は裁判官に慈悲を求めた。
courtroom	303657	He was summoned to appear in court.	彼は法廷へ出頭を命じられた。
courtroom	305782	They submitted the case to the court.	彼らはその事件を法廷に持ち出した。
courtroom	311104	She took the case into court.	彼女はそのことを裁判ざたにした。
courtroom	317887	The prisoner was brought before a judge.	被告は裁判官の前に連れていかれた。
courtroom	317889	The defendant will appeal to a higher court.	被告は上級裁判所に控訴するだろう。
courtroom	320451	The lawyer asked the judge to make allowance for the age of the accused.	弁護士は裁判官に被告人達の年齢を考慮するように求めた。
courtroom	321034	The court found him guilty.	法廷では彼を有罪と判決した。
courtroom	321038	The court acquitted him of the charge of murder.	法廷は彼のその殺人容疑について無罪とした。
courtroom	321039	The court sentenced him to death.	法廷は彼を死刑に処した。
courtroom	327976	The defendant was about to stand trial when he grabbed the deputy's gun and shot the judge.	被告人が審理中に保安係りのピストルを掴み判事を撃った。
courtroom	388857	The court ordered her to pay the fine.	裁判所は彼女に罰金を支払うように命じた。
courtroom	1003113	Do you swear to tell the truth, the whole truth, and nothing but the truth?	真実を述べ、何事も隠さず、また何事も付け加えないことを誓いますか。
courtroom	2246297	Objection!	異議あり！
possibility	15921	You may have read this book already.	君は多分この本を読んでしまったでしょう。
possibility	16076	You may laugh at me.	君は私を笑うかもしれない。
possibility	16665	You may have mistaken Jane for his sister.	君はジェーンを彼の妹と間違えたのかもしれない。
possibility	17808	You may or may not win.	君が勝つとは限らない。
possibility	18146	Judging from the look of the sky, we may have snow tomorrow.	空模様から判断すると、明日は雪になるかもしれない。
possibility	18148	Judging from the look of the sky, it may rain this afternoon.	空模様から判断すると、今日の午後は雨が降るかもしれない。
possibility	18152	From the look of the sky, it may begin to snow tonight.	空模様からすると、今夜あたり雪になるかもしれない。
possibility	23273	We will run short of oil some day.	我々はいつかは石油が不足するだろう。
possibility	25175	Something may have happened to him.	何か起きたかもしれない。
possibility	26887	It may rain.	雨が降るかもしれない。
possibility	26905	It is likely to rain.	雨が降りそうです。
possibility	26975	I may go out if the rain lets up.	雨がやんだら外出するかもしれない。
possibility	27418	Can you get a day off?	一日休みとれるの？
possibility	27890	Can I use my medical insurance?	医療保険は使えますか。
possibility	30295	It may rain soon.	雨が降りそう。
possibility	32642	It is likely to rain again.	また雨が降りそうだ。
possibility	34519	Bill may be watching this game at the stadium.	ビルは球場でこの試合を見ているかもしれない。
possibility	34606	She might not know that we are here.	ひょっとすると彼女は私たちがここにいることを知らないのかもしれない。
possibility	34612	She might know the answer.	ひょっとして彼女は答えを知っているかもしれない。
possibility	34622	Something might have happened to her.	ひょっとしたら彼女の身に何か起きたのかもしれない。
possibility	34623	He might have lost his way.	ひょっとしたら彼は道に迷ったのかもしれない。
possibility	35697	Can you come to the party?	パーティーにいらっしゃいませんか。
possibility	40563	It is likely to rain tomorrow.	たぶん明日は雨になるだろう。
possibility	40565	Perhaps she doesn't remember my birthday.	たぶん彼女は僕の誕生日を覚えていないだろう。
possibility	40569	Maybe he will be a good teacher.	たぶん彼は立派な教師になるだろう。
possibility	40585	Perhaps it will rain in the afternoon.	たぶん午後は雨が降るだろう。
possibility	40873	You probably just have a cold.	ただの風邪でしょう。
possibility	43511	Can the matter wait till tomorrow?	その用件は明日まで待てますか。
possibility	43517	We may not be able to afford it.	その余裕がないかもしれないから。
possibility	47267	You may not have heard about this.	その事はまだお聞きになっていないかもしれない。
possibility	47494	That child may have been kidnapped on his way home.	その子は帰宅の途中で誘拐されたのかもしれない。
possibility	48884	That patient may die at any time.	その患者はいつ死ぬかわからない。
possibility	48885	The patient may pass away at any moment.	その患者は今すぐにでも亡くなるかもしれない。
possibility	49585	The rumor may be true.	うわさは本当かもしれない。
possibility	49830	Can such a thing happen again?	そのようなことが再び起こりうるだろうか。
possibility	52390	Susan may not come, but Betty certainly will.	スーザンは来ないかもしれないが、しかしベティーはきっと来ます。
possibility	53124	Jack may have taken my umbrella by mistake.	ジャックは間違えて僕の傘を持っていったのかもしれない。
possibility	53493	It is likely to rain soon.	じきに雨が降ってきそうだ。
possibility	53759	Jane may not be at home now.	ジェーンは今家にいないかもしれない。
possibility	55393	This may not be a real diamond.	これは本物のダイヤではないかもしれない。
possibility	59597	From the look of the sky, it may rain in the afternoon.	この空模様だと、もしかしたら午後にはひと雨降るかもしれません。
possibility	61930	You ought to find nice shoes here.	ここでは素敵な靴が見つかるはずです。
possibility	61996	Can I catch a taxi here?	ここでタクシーをつかまえられますか。
possibility	62967	It's getting cloudy. It may rain soon.	くもってきた。やがて雨になるかもしれない。
possibility	63233	You may get a serious disease.	きみはひどい病気にかかるかもしれない。
possibility	63248	Your parents ought to know it.	きみの両親はそのことを知っているはずだ。
possibility	65022	It is likely to be fine.	おそらく天気になるだろう。
possibility	65023	His team is likely to win.	おそらく彼のチームが優勝するだろう。
possibility	66040	It may rain at any time.	いつ雨が降るかもしれない。
possibility	66041	It may rain at any moment.	いつ何時雨が降るかもしれない。
possibility	66110	He may have missed his usual bus.	いつものバスに乗れなかったのかもしれません。
possibility	66269	Can Bill still be at home?	いったいビルはまだ家にいるのでしょうか。
possibility	68086	He might be our new teacher.	あの人は私たちの新しい先生ではないだろうか。
possibility	70706	You may be right about that.	あなたの言う通りかもしれません。
possibility	241387	It's likely the Diet will be dissolved.	国会は解散するだろう。
possibility	241716	We may have a very severe earthquake any moment now.	今にも大地震が来そうなのです。
possibility	242766	It is likely to rain today.	今日は雨が降りそうだ。
possibility	243010	I think it might rain today, but I could be wrong.	今日雨かも知れないが、間違いかもしれない。
possibility	243186	Is there any chance of your coming to Tokyo again this year?	今年また東京に来ることはありますか。
possibility	243195	Can you come for dinner tonight?	今晩、食事にこられますか。
possibility	243381	It's likely to snow this evening.	今夜は雪になるだろう。
possibility	244659	He may have met her yesterday.	昨日彼は彼女にあったかもしれない。
possibility	248263	We may have missed the bus.	私たちはバスに乗り遅れたのかもしれない。
possibility	248548	We may have made a mistake.	私たちは間違いをしたかもしれない。
possibility	249969	He must be the one for me.	彼がきっと私のその人なの。
possibility	250104	You might have told me.	私に言ってくれてもよかったのに。
possibility	251739	My father may be sleeping.	私の父は眠っているかもしれない。
possibility	253036	I may have to work part time.	私はアルバイトをしなくてはいけないかも知れません。
possibility	253309	I may have put the key somewhere in this room.	私はカギをこの部屋のどこかに置いたかもしれない。
possibility	254703	I may not be able to cope with those problems.	私はその問題をうまくこなしきれないかもしれない。
possibility	255207	I may have seen that girl somewhere.	私はどこかであの女の子に会ったかもしれない。
possibility	255404	I may have left my wallet on the bus.	私はバスの中に財布を忘れてきたかもしれない。
possibility	257067	I may have told you this story before.	私は君にこの話を以前にしたかもしれません。
possibility	262155	There is a possibility that I may go to the United States next year.	私は来年アメリカに行く可能性がある。
possibility	262943	We may be late for school.	私達は学校に遅れるかもしれない。
possibility	263256	We may have to go without her.	私達は彼女を置いていかなければならないかもしれない。
possibility	263744	You might have an accident.	事故を起こしかねませんよ。
possibility	267368	There's an outside chance of winning.	勝つ可能性はごくわずかだ。
possibility	267776	You may have a slight fever.	少し熱が出るかもしれません。
possibility	269297	Can we afford a new car?	新車を買う余裕がありますか。
possibility	269805	Can I use my credit card?	診察費の支払いにクレジットカードは使えますか。
possibility	272548	It may snow.	雪が降るかもしれません。
possibility	272808	Even a teacher can make mistakes.	先生でも間違いをすることはありうる。
possibility	274956	There may be some scars.	多少あとが残るかもしれません。
possibility	274978	Perhaps the train has been delayed.	多分その列車は遅れています。
possibility	277569	It may snow in the afternoon.	昼から雪が降るかもしれない。
possibility	281860	Can you come on Sunday evening?	日曜日の晩に来られますか。
possibility	283293	He has not come yet. Something may have happened to him.	彼はまだ到着していません。彼の身に何か起きたのでしょうか?
possibility	283493	He can not have gone to school.	彼が学校に行ったはずがない。
possibility	284244	He is likely to win the championship.	彼が優勝しそうだ。
possibility	288063	He is likely to be late again.	彼はまた遅刻しそうだ。
possibility	288704	He may be able to come tomorrow.	彼はあすは来られるかもしれない。
possibility	289344	He may have told a lie.	彼はうそをついていたかもしれない。
possibility	289434	We cannot find him in the office. He may have quit his job.	彼はオフィスにいない。仕事を辞めたのかもしれない。
possibility	289903	He is likely to win this game.	彼はこの試合を勝ちそうだ。
possibility	290789	He may not have known the formula.	彼はその公式を知らなかったのかもしれない。
possibility	290990	He may have read the letter.	彼はその手紙を読んだかもしれない。
possibility	292402	He may have missed the bus.	彼はバスに乗り遅れたかもしれない。
possibility	292886	He has not come yet. He may have missed the train.	彼はまだ来ない。列車に乗り遅れたのかもしれない。
possibility	295279	He may have left for Kyoto.	彼は京都へ出発したのかもしれない。
possibility	296203	He may change his mind later.	彼は後で気が変わるかもしれない。
possibility	296239	He may be jogging around the park.	彼は公園の周りをジョギングしているかもしれません。
possibility	296645	He may come and see us tonight.	彼は今夜私たちに会いに来るかもしれない。
possibility	298244	He is likely to pass the examination.	彼は試験に合格しそうだ。
possibility	298248	He can not have passed the exam.	彼が試験に合格したはずがない。
possibility	298286	He is likely to win the game.	彼は試合に勝ちそうだ。
possibility	298435	He may be on the next train.	彼は次の列車に乗っているかもしれない。
possibility	299489	It looks like he will win.	彼は勝利したように見える。
possibility	299520	He is likely to win the scholarship.	彼は奨学金を得られそうだ。
possibility	301136	He could be in the gymnasium.	彼は多分体育館にいるでしょう。
possibility	301219	He may just be ahead of his time.	彼は大した人物にはなれないよ。
possibility	301802	He may have missed the train.	彼は電車に乗り遅れたかもしれない。
possibility	301807	He may have taken the wrong train.	彼は電車を乗り違えたのかもしれない。
possibility	302061	He may have lost his way.	彼は道に迷ったのかもしれない。
possibility	303023	He may have missed the plane.	彼は飛行機に乗り遅れたかもしれない。
possibility	303120	He may be sick in bed.	彼は病気で寝ているかもしれない。
possibility	304549	He may come, or he may not.	彼は来るかもしれないし、来ないかもしれない。
possibility	305621	They may not know anything about this.	彼らはこの事を何も知らないかもしれない。
possibility	305705	They may not know about it.	彼らはそのことについて知らないかもしれない。
possibility	306512	They may be playing in the park.	彼らは公園で遊んでいるかもしれない。
possibility	307563	They might tell us the truth.	彼らは本当のことを言ってくれるのかもしれない。
possibility	308334	She may be our teacher.	彼女が私達の先生かもしれない。
possibility	308355	She stands a good chance of winning the prize.	彼女が授賞する見込みは十分にある。
possibility	310210	She may have missed the 7:00 train.	彼女は７時の列車に乗り遅れたかもしれない。
possibility	310278	They might be taller than you.	彼らは君より背が高いかもしれない。
possibility	310684	She might be having coffee in the cafeteria.	彼女はカフェテリアでコーヒーを飲んでいるかもしれない。
possibility	310865	She may not wait any longer.	彼女はこれ以上待てないかもしれない。
possibility	311062	She may have said so.	彼女はそう言ったかもしれない。
possibility	312236	She may not have finished her homework.	彼女はまだ宿題を終えていなかったのかもしれない。
possibility	312249	She hasn't come yet. She may have taken a wrong bus.	彼女はまだ来ない。間違ったバスに乗ったのかもしれない。
possibility	313094	She may not be aware of the danger.	彼女は危険に気付いていないかもしれない。
possibility	313694	She may not be at home now.	彼女は今家にいないかもしれない。
possibility	313740	She may not come to the party tonight.	彼女は今夜のパーティーに来ないかもしれない。
possibility	313874	She may have left her umbrella on the bus.	彼女は傘をバスの中に忘れたかもしれません。
possibility	314062	She might know that we are here.	彼女は私たちがここにいることをしらないかもしれない。
possibility	314136	She may have told me a lie.	彼女は私にうそをついたのかもしれない。
possibility	314819	She may have left her car key in her room.	彼女は車の鍵を部屋に置き忘れたのかもしれない。
possibility	315172	She may know the facts.	彼女は真実を知っているかもしれない。
possibility	315937	She may have missed her train.	彼女は電車に乗り遅れたかもしれない。
possibility	315989	She may have known the answer.	彼女は答を知っていたのかもしれない。
possibility	316156	She may have gone out to do some shopping.	彼女は買い物をしに外出したかもしれない。
possibility	316430	She may not like his attitude.	彼女は彼の態度が好きでないかもしれない。
possibility	317159	She may not come here tomorrow.	彼女は明日ここへ来ないかもしれない。
possibility	317370	She may have to quit her job next month.	彼女は来月退職しなければならないかもしれません。
possibility	317865	She may spill the beans.	秘密をばらすかもしれん。
possibility	318023	The plane could easily be late.	飛行機の遅れることはまず間違いない。
possibility	319132	My father may be at home now.	父は今家にいるかもしれません。
possibility	320291	It may help to look at the problem from another angle.	別の角度から問題を見ると役に立つかもしれない。
possibility	323087	It may possibly be fine tomorrow.	ひょっとしたら明日は晴れるかもしれない。
possibility	323258	It may rain tomorrow.	明日は雨かもしれない。
possibility	323267	It seems it'll rain tomorrow.	明日は雨になるでしょう。
possibility	323306	It is likely to be fine tomorrow.	明日は天気になりそうだ。
possibility	323976	It may rain in the evening.	夜には雨になるかもしれない。
possibility	323991	It may have rained during the night.	夜の間に雨が降ったのかもしれない。
possibility	324632	It seems that supper will be late.	夕食は遅くなるようだ。
possibility	388731	She may come.	彼女は来るかもしれない。
possibility	398976	Can I use a credit card?	支払いにカードは使えますか？
possibility	889681	I think that it might rain.	雨の降る予感がする。
possibility	915342	I may give up soon and just take a nap.	すぐに諦めて昼寝をするかも知れない。
possibility	2241060	We could die.	僕らは死ぬかもしれない。
restaurant	1710	The check, please.	お愛想お願いします。
restaurant	2423	Did you leave a tip?	チップを置きましたか。
restaurant	18124	Could we have a table in the corner?	角のテーブルがいいのですが。
restaurant	19483	Beef, please.	ビーフをお願いします。
restaurant	19541	Waiter, please bring me some water.	給仕さん水をいただけませんか。
restaurant	21098	Check, please.	お勘定お願いします。
restaurant	21104	May I have the check, please?	お勘定をお願いします。
restaurant	22015	Could we have a table outside?	外のテーブルがいいのですが。
restaurant	22240	Do you have a table with a view of the ocean?	海の見える席がありますか。
restaurant	22462	Could I have the check?	会計をお願いします。
restaurant	24765	What would you like to drink?	お飲み物はいかがなさいますか？
restaurant	25196	Would you like to drink anything?	お飲み物はよろしいですか。
restaurant	27696	Put it on one bill, please.	一緒に勘定して下さい。
restaurant	29220	I'd like to have a glass of wine.	ワインを一杯いただけますか。
restaurant	29222	We'd like another bottle of wine.	ワインをもう一本ください。
restaurant	29223	We'd like to have some wine.	ワインをいただきます。
restaurant	29224	May I see the wine list?	ワインリストを見せて下さい。
restaurant	29490	A tea with lemon, please.	レモンティーを一杯ください。
restaurant	29546	I would like mine rare.	レアでお願いします。
restaurant	29720	Two for the lunch buffet, please.	ランチブッフェを二人、お願いします。
restaurant	29824	Do you have any light beer?	ライトビールはありますか。
restaurant	31489	Can I have the menu again, please?	もう一度メニューを見せていただけますか。
restaurant	31785	May I have the menu, please?	メニューをいただけますか。
restaurant	31786	Let me see a menu.	メニューをお願いします。
restaurant	31787	May I see a menu, please?	メニューを見せていただけませんか。
restaurant	32797	I think I'll start with a bottle of beer.	まずビールからはじめよう。
restaurant	32803	I'd like to have mustard on the side.	マスタードを別に持ってきてください。
restaurant	34033	Would you like bacon or sausage?	ベーコンかソーセージはいかがか。
restaurant	34185	Do you have any French wine?	フランスのワインはありますか。
restaurant	34281	Large fries, please.	ポテトのLを1つ。
restaurant	34313	Give me a bottle of wine.	ワインを一本ください。
restaurant	34381	Could we have a fork?	フォークをいただけますか。
restaurant	35120	Two vanilla ice creams please.	バニラアイスクリームを二つ下さい。
restaurant	36286	May I have a napkin, please?	ナプキンを頂けますか。
restaurant	38297	I'd like two slices of toast and a cup of tea.	トースト２枚と紅茶１杯をください。
restaurant	39476	I'd like to have cake for dessert.	デザートにはケーキをいただきたい。
restaurant	41229	I'd like a daiquiri.	ダイキリをください。
restaurant	45251	Does that price include soup and salad?	その値段はサラダとスープ込みですか。
restaurant	51049	I'd like the sauce on the side.	ソースを別にください。
restaurant	51050	I'd like to have the sauce on the side, please.	ソースは別に添えてください。
restaurant	51817	Could we have a spoon?	スプーンをいただけますか。
restaurant	51919	I would like steak with a baked potato.	ステーキにポテトをつけてください。
restaurant	53029	Some juice, please.	ジュースをください。
restaurant	54004	I want Italian dressing on my salad.	サラダのドレッシングはイタリアンがいいです。
restaurant	54163	I'd like some cider, please.	サイダーをください。
restaurant	54308	Do you have a reservation?	ご予約はいただいていますか。
